[
  {
    "id": "web-semantico-rdf-owl",
    "title": "Web Semantico: RDF, OWL, SPARQL",
    "area": 5,
    "gruppo": "A",
    "tipo": "concetto",
    "sapere": "Il Web Semantico (Tim Berners-Lee) mira a rendere i dati comprensibili dalle macchine. RDF (Resource Description Framework) descrive risorse con triple: soggetto-predicato-oggetto. OWL (Web Ontology Language) definisce ontologie (gerarchie di concetti e relazioni). SPARQL è il linguaggio di query per RDF. Linked Data collega dati da fonti diverse.",
    "saper_fare": [
      "Spiegare il concetto di tripla RDF",
      "Distinguere RDF da OWL",
      "Scrivere una query SPARQL semplice"
    ],
    "prerequisiti": [],
    "esercizi": [
      {
        "tipo_esame": "scritto: tripla RDF",
        "testo": "Rappresenta in RDF/Turtle che 'Alice' ha 'email' 'alice@example.com'.",
        "soluzione": "@prefix ex: <http://example.org/> .\n\nex:Alice ex:email \"alice@example.com\" .\n\n# Oppure in RDF/XML:\n<rdf:RDF xmlns:rdf=\"http://www.w3.org/1999/02/22-rdf-syntax-ns#\"\n         xmlns:ex=\"http://example.org/\">\n  <rdf:Description rdf:about=\"http://example.org/Alice\">\n    <ex:email>alice@example.com</ex:email>\n  </rdf:Description>\n</rdf:RDF>"
      }
    ],
    "tempo_studio_min": 60,
    "priorita": {
      "livello": "alta",
      "motivazione": "Gruppo A. Argomento ricorrente nelle prove."
    },
    "risorse": [
      {
        "titolo": "W3C: Semantic Web",
        "url": "https://www.w3.org/standards/semanticweb/",
        "verificato": true
      },
      {
        "titolo": "W3C: RDF",
        "url": "https://www.w3.org/RDF/",
        "verificato": true
      },
      {
        "titolo": "W3C: OWL",
        "url": "https://www.w3.org/OWL/",
        "verificato": true
      },
      {
        "titolo": "W3C: SPARQL",
        "url": "https://www.w3.org/TR/sparql11-query/",
        "verificato": true
      }
    ],
    "riferimenti_testo": [
      {
        "libro": "W3C"
      }
    ],
    "checklist_ripasso": [
      "Web Semantico: dati comprensibili dalle macchine",
      "RDF: Resource Description Framework (triple: soggetto-predicato-oggetto)",
      "OWL: Web Ontology Language (ontologie, gerarchie)",
      "SPARQL: query language per RDF",
      "Linked Data: collegamento dati da fonti diverse"
    ],
    "worker": "W3"
  },
  {
    "id": "sparql-query-esempi",
    "title": "SPARQL: esempi di query",
    "area": 5,
    "gruppo": "A",
    "tipo": "abilita",
    "sapere": "SPARQL è il linguaggio di query per dati RDF. Sintassi base: SELECT ?variabili WHERE { pattern } con triple pattern (soggetto predicato oggetto). Filtri con FILTER, opzionali con OPTIONAL, unioni con UNION. Formati di output: JSON, XML, CSV, TSV.",
    "saper_fare": [
      "Scrivere query SPARQL SELECT",
      "Usare FILTER per condizionare i risultati",
      "Eseguire query su endpoint SPARQL pubblici"
    ],
    "prerequisiti": [
      {
        "id": "web-semantico-rdf-owl",
        "forza": "hard",
        "motivo": "SPARQL è il linguaggio di query per RDF."
      }
    ],
    "esercizi": [
      {
        "tipo_esame": "scritto: query SPARQL",
        "testo": "Scrivi una query SPARQL per trovare tutte le persone con email che contiene 'example.com'.",
        "soluzione": "PREFIX ex: <http://example.org/>\nSELECT ?persona ?email\nWHERE {\n  ?persona ex:email ?email .\n  FILTER(contains(?email, \"example.com\"))\n}"
      }
    ],
    "tempo_studio_min": 40,
    "priorita": {
      "livello": "media",
      "motivazione": "Gruppo A. Importante per applicazioni pratiche."
    },
    "risorse": [
      {
        "titolo": "W3C: SPARQL 1.1 Query Language",
        "url": "https://www.w3.org/TR/sparql11-query/",
        "verificato": true
      },
      {
        "titolo": "DBpedia SPARQL Endpoint",
        "url": "https://dbpedia.org/sparql",
        "verificato": true
      },
      {
        "titolo": "Wikidata Query Service",
        "url": "https://query.wikidata.org/",
        "verificato": true
      }
    ],
    "riferimenti_testo": [
      {
        "libro": "W3C"
      }
    ],
    "checklist_ripasso": [
      "SELECT ?var WHERE { pattern }",
      "Triple pattern: ?s ?p ?o",
      "FILTER: condizionare risultati",
      "OPTIONAL: risultati opzionali",
      "UNION: combinare pattern"
    ],
    "worker": "W3"
  },
  {
    "id": "ajax-fetch-xhr",
    "title": "AJAX: Asynchronous JavaScript and XML",
    "area": 5,
    "gruppo": "B",
    "tipo": "abilita",
    "sapere": "AJAX permette di fare richieste HTTP asincrone senza ricaricare la pagina. Tecnologie: XMLHttpRequest (XHR, legacy), fetch() API (moderna), e librerie come Axios. JSON è il formato dati più comune (non XML come suggerisce il nome). Passaggi: 1) Crea richiesta, 2) Invia, 3) Aspetta risposta, 4) Elabora dati, 5) Aggiorna DOM.",
    "saper_fare": [
      "Fare richieste AJAX con fetch",
      "Gestire la risposta JSON",
      "Aggiornare il DOM con i dati ricevuti"
    ],
    "prerequisiti": [
      {
        "id": "javascript-fetch-async-await",
        "forza": "hard",
        "motivo": "fetch() è l'API moderna per AJAX."
      }
    ],
    "esercizi": [
      {
        "tipo_esame": "scritto: AJAX con fetch",
        "testo": "Scrivi codice per caricare dati da /api/posts e visualizzarli in una lista HTML.",
        "soluzione": "async function loadPosts() {\n  try {\n    const response = await fetch('/api/posts');\n    if (!response.ok) throw new Error('Errore');\n    const posts = await response.json();\n    \n    const list = document.getElementById('posts');\n    list.innerHTML = '';\n    \n    posts.forEach(post => {\n      const li = document.createElement('li');\n      li.textContent = post.title;\n      list.appendChild(li);\n    });\n  } catch (error) {\n    console.error('Errore:', error);\n  }\n}\n\n// Chiamata\ndocument.addEventListener('DOMContentLoaded', loadPosts);"
      }
    ],
    "tempo_studio_min": 45,
    "priorita": {
      "livello": "media",
      "motivazione": "Gruppo B. Importante per applicazioni dinamiche."
    },
    "risorse": [
      {
        "titolo": "MDN: AJAX",
        "url": "https://developer.mozilla.org/en-US/docs/Web/Guide/AJAX",
        "verificato": true
      },
      {
        "titolo": "MDN: XMLHttpRequest",
        "url": "https://developer.mozilla.org/en-US/docs/Web/API/XMLHttpRequest",
        "verificato": true
      },
      {
        "titolo": "MDN: Using Fetch",
        "url": "https://developer.mozilla.org/en-US/docs/Web/API/Fetch_API/Using_Fetch",
        "verificato": true
      }
    ],
    "riferimenti_testo": [
      {
        "libro": "MDN"
      }
    ],
    "checklist_ripasso": [
      "AJAX: Asynchronous JavaScript And XML (ma usa JSON)",
      "API: XMLHttpRequest (legacy), fetch() (moderna)",
      "Passaggi: crea → invia → aspetta → elabora → aggiorna DOM",
      "Asincrono: non blocca l'interfaccia utente"
    ],
    "worker": "W3"
  },
  {
    "id": "web-1-0-2-0-3-0-4-0-evoluzione",
    "title": "Evoluzione del Web: 1.0 → 2.0 → 3.0 → 4.0",
    "area": 5,
    "gruppo": "B",
    "tipo": "concetto",
    "sapere": "Web 1.0 (anni '90): pagine statiche, solo lettura, HTML di base, contenuto creato da esperti. Web 2.0 (2000s): pagine dinamiche, interazione utente, user-generated content, AJAX, social media, API. Web 3.0 (2010s): web semantico, dati collegati, intelligenza artificiale, personalizzazione, ontologie. Web 4.0 (emergente): web ubiquo, IoT, integrazione profonda con il mondo fisico, AI generativa, intelligenza ambientale.",
    "saper_fare": [
      "Distinguere le caratteristiche di ogni generazione",
      "Fornire esempi di tecnologie per ogni generazione",
      "Spiegare l'evoluzione tecnologica e sociale"
    ],
    "prerequisiti": [],
    "esercizi": [
      {
        "tipo_esame": "scritto: evoluzione",
        "testo": "Elenca le principali differenze tra Web 1.0, 2.0, 3.0 e 4.0.",
        "soluzione": "Web 1.0: statico, lettura, HTML base, contenuto professionale\nWeb 2.0: dinamico, lettura/scrittura, user-generated content, AJAX, API, social\nWeb 3.0: semantico, Linked Data, ontologie (RDF, OWL), AI, personalizzazione\nWeb 4.0: ubiquo, IoT, integrazione fisico-digitale, AI generativa, contest-aware"
      }
    ],
    "tempo_studio_min": 35,
    "priorita": {
      "livello": "media",
      "motivazione": "Gruppo B. Argomento culturale/tecnologico."
    },
    "risorse": [
      {
        "titolo": "Wikipedia: Web 2.0",
        "url": "https://en.wikipedia.org/wiki/Web_2.0",
        "verificato": true
      },
      {
        "titolo": "Wikipedia: Web 3.0",
        "url": "https://en.wikipedia.org/wiki/Web_3.0",
        "verificato": true
      },
      {
        "titolo": "W3C: Semantic Web",
        "url": "https://www.w3.org/standards/semanticweb/",
        "verificato": true
      }
    ],
    "riferimenti_testo": [
      {
        "libro": "W3C"
      }
    ],
    "checklist_ripasso": [
      "Web 1.0: statico, lettura, HTML base",
      "Web 2.0: dinamico, user-generated, AJAX, social",
      "Web 3.0: semantico, Linked Data, AI",
      "Web 4.0: ubiquo, IoT, AI generativa"
    ],
    "worker": "W3"
  }
]
